ID,Language_ID,Primary_Text,Analyzed_Word,Gloss,Translated_Text,Meta_Language_ID,LGR_Conformance,Comment,Media_IDs,Position,Audio_Start,Audio_End,graid,add_orthography,Text_ID,refind,refindFK,isnref
mill_0006,mcsanzhi,"urχːab akːʷarre čula bahat'unne deq'a delq'anaj, tːura buqunnecabi činab birq'andaja, wallah heχtːub birq'anda daxanda",#	urχːab	akːʷ-ar-re	ču-la	#	0	bahat'-un-ne	#	0	deq'a	d-elq'-an-aj	#	0	tːura	b-uq-un-ne	cabi	#	čina-b	0	0	b-irq'-an-da	=ja	#	wallah	heχ-tːu-b	0	0	b-irq'-an-da	#	0	d-ax-an-da,#	mill	NEG-PRS-CVB	REFL.PL-GEN	#	0_people	be.anxious-ICVB-CVB	#	0_people	grain	NPL-mill.PFV-PTCP-INF2.3	#	0_people	outside	N-go.PFV-PRET-CVB	be<HPL>	#	where-N	0_people	0_mill	N-do.IPFV-PTCP-1	=Q	#	by.God	DEM.down-LOC-N	0_people	0_mill	N-do.IPFV-PTCP-1	#	0_people	1/2PL-go-PTCP-1,"Without a mill the people were anxious about grinding the grain [i.e. it was difficult]; they went outside, ""Where should we build (a mill)? By God, we will build it there. Let's go.""",en,MORPHEME_ALIGNED,,mill_mp3 mill_wav mill_eaf mill_xml mill_tsv,,32914,44130,#cv.neg	np:s	other:predex	refl.h:obl	#cv	0.h:s_cv	v:pred	#ac_in	0.h:a_in	np:p	v:pred	#cv	0.h:s_cv	other	v:pred	rv_aux	#ds_pc	intrg_other:l	0.1:a_cv	0:p	v:pred	=other	#ds_pc	other	dem_pro:l	0.1:a_cv	0:p	v:pred	#ds_pc	0.1:s_pc	v:pred,,mill,∅	538	∅	501	∅	501	∅	∅	501	502	∅	∅	501	∅	∅	∅	∅	∅	501	503	∅	∅	∅	∅	504	501	503	∅	∅	501	∅,∅	538	∅	501	∅	501	∅	∅	501	502	∅	∅	501	∅	∅	∅	∅	∅	501	503	∅	∅	∅	∅	504	501	503	∅	∅	501	∅,∅	new	∅	bridging	∅	∅	∅	∅	∅	bridging	∅	∅	∅	∅	∅	∅	∅	∅	∅	bridging	∅	∅	∅	∅	new	∅	∅	∅	∅	∅	∅
mill_0007,mcsanzhi,tːura buqunne šːante agurre cab,#	tːura	b-uq-un-ne	šːan-te	#	0	ag-ur-re	ca-b,#	outside	HPL-go.PFV-PRET-CVB	fellow.villager-PL	#	0_people	go.PFV-PRET-CVB	be-HPL,The villagers went outside [i.e. left the village].,en,MORPHEME_ALIGNED,,mill_mp3 mill_wav mill_eaf mill_xml mill_tsv,,44130,49722,#cv	other	v:pred	np.h:s_cv	#cv	0.h:s_cv	v:pred	rv_aux,,mill,∅	∅	∅	501	∅	501	∅	∅,∅	∅	∅	501	∅	501	∅	∅,∅	∅	∅	∅	∅	∅	∅	∅
mill_0008,mcsanzhi,"birq'ul, birq'ul, birq'ul, birq'ul, rurger barq'iblecab, qalla musːa barq'iblecab",#	0	b-irq'-ul	0	#	0	b-irq'-ul	0	#	0	b-irq'-ul	0	#	0	b-irq'-ul	0	#	0	rurger	b-arq'-ib-le	ca-b	#	0	qal-la	musːa	b-arq'-ib-le	ca-b,#	0_people	N-do.IPFV-ICVB	0_mill	#	0_people	N-do.IPFV-ICVB	0_mill	#	0_people	HPL-do.IPFV-ICVB	0_mill	#	0_people	N-do.IPFV-ICVB	0_mill	#	0_people	water.channel	N-do.PFV-PRET-CVB	be-N	#	0_people	house-GEN	place	N-do.PFV-PRET-CVB	be-N,"They were building, building, building, they built the channel for the water, they prepared the place for the millhouse.",en,MORPHEME_ALIGNED,,mill_mp3 mill_wav mill_eaf mill_xml mill_tsv,,49722,60661,#cv	0.h:a_cv	v:pred	0:p	#nc	nc_0.h	nc	nc_0	#nc	nc_0.h	nc	nc_0	#nc	nc_0.h	nc	nc_0	#cv	0.h:a_cv	np:p	v:pred	rv_aux	#cv	0.h:a_cv	ln_np:poss	np:p	v:pred	rv_aux,,mill,∅	501	∅	503	∅	501	∅	503	∅	501	∅	503	∅	501	∅	503	∅	501	505	∅	∅	∅	501	∅	506	∅	∅,∅	501	∅	503	∅	501	∅	503	∅	501	∅	503	∅	501	∅	503	∅	501	505	∅	∅	∅	501	∅	506	∅	∅,∅	∅	∅	∅	∅	∅	∅	∅	∅	∅	∅	∅	∅	∅	∅	∅	∅	∅	bridging	∅	∅	∅	∅	∅	bridging	∅	∅
mill_0009,mcsanzhi,"na barq'ible taman biχuble, ca ʡaˁχːuˁl dak'u uquncaw",#	na	0	0	b-arq'-ib-le	#	taman	b-iχ-ub-le	#	ca	ʡaˁχːuˁl	dak'u	uq-un	ca-w,#	now	0_people	0_mill	N-do.PFV-PRET-CVB	#	end	N-be.PFV-PRET-CVB	#	one	guest	appear	go.PFV-PRET	be-M,"When they had finished building, a man appeared.",en,MORPHEME_ALIGNED,,mill_mp3 mill_wav mill_eaf mill_xml mill_tsv,,60661,68049,#cv	other	0.h:a_cv	0:p	v:pred	#cv	np:s	v:pred	##	ln_deti	np.h:s_cps	other:lvc	v:pred	rv_aux,,mill,∅	∅	501	503	∅	∅	∅	∅	∅	∅	507	∅	∅	∅,∅	∅	501	503	∅	∅	∅	∅	∅	∅	507	∅	∅	∅,∅	∅	∅	∅	∅	∅	∅	∅	∅	∅	new	∅	∅	∅
mill_0010,mcsanzhi,"Allahli watkaʁibil užibcaw il, heltːub urχːab aarganne laˁk' digaj haʔible",#	Allah-li	w-at	k-aʁ-ib-il	už-ib	ca-w	il	#	heltːu-b	urχːab	a-arg-an-ne	#	0	laˁk'	d-ig-aj	#	0	ha-ʔ-ib-le,#	Allah-ERG	M-let.PFV	down-do.PFV-PRET-PTCP	be-PRET	be-M	that	#	there-N	mill	NEG-go.IPFV-PTCP-PRS.3	#	0_people	away	NPL-be.PFV-IMP.PL	#	0_man	upwards-say.PFV-PRET-CVB,"Allah had sent him; he said, ""The mill will not work there, go away!""",en,MORPHEME_ALIGNED,,mill_mp3 mill_wav mill_eaf mill_xml mill_tsv,,68049,76915,##	np.h:a	v:pred	rv_aux	rv_aux	rv_aux	dem_pro.h:p	##ds.neg	other:l	np:s	v:pred	##ds	0.2:s_cps	other:lvc	v:pred	#cv	0.h:a_ds_cv	v:pred,,mill,∅	508	∅	∅	∅	∅	507	∅	504	504	∅	∅	501	∅	∅	∅	507	∅,∅	508	∅	∅	∅	∅	507	∅	504	504	∅	∅	501	∅	∅	∅	507	∅,∅	unused	∅	∅	∅	∅	∅	∅	∅	∅	∅	∅	∅	∅	∅	∅	∅	∅
mill_0011,mcsanzhi,salam abičːible il admi sarituquncaw,#	#	0	0	salam	a-b-ičː-ib-le	%	il	admi	sa-r-ituq-un	ca-w,#	#	0_man	0_people	greeting	NEG-N-give.PFV-PRET-CVB	%	that	person	ANTE-ABL-cross.PFV-PRET	be-M,"Not greeting them, the man passed by.",en,MORPHEME_ALIGNED,,mill_mp3 mill_wav mill_eaf mill_xml mill_tsv,,76915,81251,##	#cv.neg	0.h:a_cv	0.h:g	np:p	v:pred	%	ln_dem	np.h:s	v:pred	rv_aux,,mill,∅	∅	507	501	∅	∅	∅	∅	507	∅	∅,∅	∅	507	501	∅	∅	∅	∅	507	∅	∅,∅	∅	∅	∅	∅	∅	∅	∅	∅	∅	∅
mill_0012,mcsanzhi,"waˁħ ik'ulcaw ca, cellij itil salam alukːane nišːicːe?",#	waˁħ	ik'-ul	ca-w	ca	#	cellij	it-i-l	salam	a-lukː-an	=e	nišːi-cːe,#	wah	say.IPFV-ICVB	be-M	one	#	why	that-OBL-ERG	greeting	NEG-give.IPFV-PTCP	=Q	1PL-IN,"""Wah,"" said one, ""Why did he not greet us?",en,MORPHEME_ALIGNED,,mill_mp3 mill_wav mill_eaf mill_xml mill_tsv,,81251,85618,#cv	other	v:pred	rv_aux	np.h:s_ds_cv	#ds_pc.neg	other	dem_pro.h:a	np:p	v:pred	=other	pro.1:g,,mill,∅	∅	∅	∅	509	∅	∅	507	∅	∅	∅	501,∅	∅	∅	∅	509	∅	∅	507	∅	∅	∅	501,∅	∅	∅	∅	bridging	∅	∅	∅	∅	∅	∅	∅
mill_0013,mcsanzhi,"nušːa heštːud dirq'ul ledle, hari dawaj hitːi duqene, hitːi buqunne ca k'ʷel žahil durħuˁ ucibcaw",#	nušːa	heštːu-d	d-irq'-ul	le-d-le	#	0	hari	dawaj	hitːi	d-uq-ene	#	0	hitːi	b-uq-un-ne	#	ca	k'ʷel	žahil	durħuˁ	0	uc-ib	ca-w,#	1PL	here-1/2PL	1/2PL-do.IPFV-ICVB	exist-1/2PL-CVB	#	0_we	let's!	let's	after	1/2PL-go.PFV-IMP.PL	#	0_people	after	HPL-go.PFV-PRET-CVB	#	one	two	young	boy	0_man	catch.PFV-PRET	be-M,"We who are here building, let us run after him!"" They ran after him, and one or two young boys caught up with him.",en,MORPHEME_ALIGNED,,mill_mp3 mill_wav mill_eaf mill_xml mill_tsv,,85618,97514,##ds	pro.1:s	other:l	v:pred	rv_v	##ds	0.h:s	lv_aux	lv_aux	other	v:pred	#cv	0.h:s_cv	other	v:pred	##	ln_num	ln_num	ln_adj	np.h:s	0.h:p	v:pred	rv_aux,,mill,∅	534	∅	∅	∅	∅	534	∅	∅	∅	∅	∅	534	∅	∅	∅	∅	∅	∅	510	507	∅	∅,∅	534	∅	∅	∅	∅	534	∅	∅	∅	∅	∅	534	∅	∅	∅	∅	∅	∅	510	507	∅	∅,∅	bridging	∅	∅	∅	∅	∅	∅	∅	∅	∅	∅	∅	∅	∅	∅	∅	∅	∅	bridging	∅	∅	∅
mill_0014,mcsanzhi,"cellij, bik'ulcab, ul nišːicːe salam abičːibde, nušːa χalq' ʡaˁčil dirq'an χalq'deq'al",#	cellij	0	b-ik'-ul	ca-b	#	u-l	nišːi-cːe	salam	a-b-ičː-ib-de	#	nušːa	χalq'	#	0	ʡaˁči-l	d-irq'-an	%	χalq'-de	=q'al,#	why	0_boys	HPL-say.IPFV-ICVB	be-HPL	#	2SG-ERG	1PL-IN	greeting	NEG-N-give.PFV-PRET-2SG	#	1PL	people	#	0_people	work-ERG	1/2PL-do.IPFV-PTCP	%	people-PST	=MOD,"""Why,"" they said, ""did you not greet us? We people who are working are people too [i.e. human beings]!""",en,MORPHEME_ALIGNED,,mill_mp3 mill_wav mill_eaf mill_xml mill_tsv,,97514,105369,#cv	other	0.1:s_ds_cv	v:pred	rv_aux	##ds.neg	pro.2:a	pro.1:g	np:g	v:pred	##ds	pro.1:s	np.h:appos	#rc_pc	rel_f0.1:s	np:obl	v:pred	%	np.h:pred	=other,,mill,∅	∅	510	∅	∅	∅	507	534	∅	∅	∅	534	∅	∅	534	∅	∅	∅	∅	∅,∅	∅	510	∅	∅	∅	507	534	∅	∅	∅	534	∅	∅	534	∅	∅	∅	∅	∅,∅	∅	∅	∅	∅	∅	∅	∅	∅	∅	∅	∅	∅	∅	∅	∅	∅	∅	∅	∅
mill_0015,mcsanzhi,"waˁħ, ik'ulcaw, dul bičːibda, ik'ulcaw salam ašːala hinna t'amal, ik'ulcaw, t'amabaq'ibda ašːij",#	waˁħ	0	ik'-ul	ca-w	#	du-l	b-ičː-ib-da	#	0	ik'-ul	ca-w	%	salam	#	ašːa-la	hin-na	t'ama-l	ik'-ul	ca-w	#	t'am	a-b-aq'-ib-da	ašːi-j,#	wah	0_man	say.IPFV-ICVB	be-M	#	1SG-ERG	N-give.PFV-PRET-1	#	0_man	say.IPFV-ICVB	be-M	%	greeting	#	2PL-GEN	water-GEN	sound-ERG	say.IPFV-ICVB	be-M	#	sound	NEG-N-hear.PFV-PRET-1	2PL-DAT,"""Wah,"" he said, ""I greeted you, but because of the sound of your water, you did not hear.""",en,MORPHEME_ALIGNED,,mill_mp3 mill_wav mill_eaf mill_xml mill_tsv,,105369,115265,#cv	other	0.h:s_ds_cv	v:pred	rv_aux	##ds	pro.1:a	v:pred	#cv	0.h:s_ds_cv	v:pred	rv_aux	%	np:p	#ds_cv	ln_pro.2:poss	ln_np:poss	np:a_ds_cv	v:pred	rv_aux	##ds.neg	np:p	v:pred	pro.2:ncs,,mill,∅	∅	507	∅	∅	∅	507	∅	∅	507	∅	∅	∅	∅	∅	501	511	512	∅	∅	∅	∅	∅	501,∅	∅	507	∅	∅	∅	507	∅	∅	507	∅	∅	∅	∅	∅	501	511	512	∅	∅	∅	∅	∅	501,∅	∅	∅	∅	∅	∅	∅	∅	∅	∅	∅	∅	∅	∅	∅	∅	new	bridging	∅	∅	∅	∅	∅	∅
mill_0016,mcsanzhi,"waˁħ, bik'ulcab, hinq'ar tedakːu itːud",#	waˁħ	0	b-ik'-ul	ca-b	#	hin	=q'ar	te-d-akːu	itːu-d,#	wah	0_boys	HPL-say.IPFV-ICVB	be-HPL	#	water	=MOD	exist-NPL-NEG	there-NPL,"""Wah,"" they said, ""but there is no water.""",en,MORPHEME_ALIGNED,,mill_mp3 mill_wav mill_eaf mill_xml mill_tsv,,115265,119433,#cv	other	0.h:s_ds_cv	v:pred	rv_aux	##ds.neg	np:s	=other	other:predex	other:l,,mill,∅	∅	510	∅	∅	∅	511	∅	∅	504,∅	∅	510	∅	∅	∅	511	∅	∅	504,∅	∅	∅	∅	∅	∅	∅	∅	∅	∅
mill_0017,mcsanzhi,"c'il ik'ulcaw, hin akːʷarilleb urχːab abirχʷniq'al ašːij baχere, ik'ulcaw, hin akːʷarilleb urχːab abuq'ni",#	c'il	0	ik'-ul	ca-w	#	#	0	hin	akːʷ-ar-il-le-b	%	urχːab	a-b-irχʷ-ni	=q'al	#	ašːi-j	0	b-aχ-ere	#	0	ik'-ul	ca-w	#	#	0	hin	akːʷ-ar-il-le-b	%	urχːab	a-b-uq'-ni,#	then	0_man	say.IPFV-ICVB	be-M	#	#	0_mill	water	NEG-PRS-PTCP-SPR-N	%	mill	NEG-N-be.able.IPFV-MSD	=MOD	#	2PL-DAT	0_that	N-know.PFV-IMP.PL	#	0_man	say.IPFV-ICVB	be-M	#	#	0_mill	water	NEG-PRS-PTCP-SPR-N	%	mill	NEG-N-mill.IPFV-MSD,"He said, where there is no water a mill cannot be, you should know this! A mill cannot not mill where there is no water.",en,MORPHEME_ALIGNED,,mill_mp3 mill_wav mill_eaf mill_xml mill_tsv,,119433,128003,#cv	other	0.h:s_ds_cv	v:pred	rv_aux	#ds.neg	#ds_rc_pc.neg	rel_f0.h:obl	np:s_pc	other:predex	%	np:s	v:pred	=other	##ds	pro.2:ncs	0:p	v:pred	#cv	0.h:s_ds_cv	v:pred	rv_aux	#ds_cc.neg:p	#ds_rc_pc.neg	rel_f0.h:obl	np:s	other:predex	%	np:s	v:pred,,mill,∅	∅	507	∅	∅	∅	∅	503	∅	∅	∅	503	∅	∅	∅	534	535	∅	∅	507	∅	∅	∅	∅	503	∅	∅	∅	503	∅,∅	∅	507	∅	∅	∅	∅	503	∅	∅	∅	503	∅	∅	∅	534	535	∅	∅	507	∅	∅	∅	∅	503	∅	∅	∅	503	∅,∅	∅	∅	∅	∅	∅	∅	∅	∅	∅	∅	∅	∅	∅	∅	∅	bridging	∅	∅	∅	∅	∅	∅	∅	∅	∅	∅	∅	∅	∅
mill_0018,mcsanzhi,"wat', hawala urχːab birq'uldaw, ik'ulcaw, ušːali, č'anna urχːab?",#	wat'	hawa-la	urχːab	b-irq'-ul-da	=w	#	0	ik'-ul	ca-w	%	ušːa-li	č'an-na	urχːab,#	well	air-GEN	mill	N-do.IPFV-ICVB-1	=Q	#	0_man	say.IPFV-ICVB	be-M	%	2PL-ERG	wind-GEN	mill,"Well, are you building a windmill?"" he said, ""A windmill?""",en,MORPHEME_ALIGNED,,mill_mp3 mill_wav mill_eaf mill_xml mill_tsv,,128003,136060,#ds_cv	other	ln_np:poss	np:p	v:pred	=other	#cv	0.h:s_ds_cv	v:pred	rv_aux	%	pro.2:a_cv	ln_np:poss	np:other,,mill,∅	∅	∅	513	∅	∅	∅	507	∅	∅	∅	534	∅	513,∅	∅	∅	513	∅	∅	∅	507	∅	∅	∅	534	∅	513,∅	∅	∅	bridging	∅	∅	∅	∅	∅	∅	∅	∅	∅	∅
mill_0019,mcsanzhi,"akːʷadi nušːal hinna urχːab birq'ulda,",#	akːʷa-di	nušːa-l	hin-na	urχːab	b-irq'-ul-da,#	be.NEG-1	1PL-ERG	water-GEN	mill	N-do.IPFV-ICVB-1,"""No, we are not, we are building a watermill.""",en,MORPHEME_ALIGNED,,mill_mp3 mill_wav mill_eaf mill_xml mill_tsv,,136060,140200,#ds_cv	other	pro.1:a_cv	ln_np:poss	np:p	v:pred,,mill,∅	∅	534	∅	∅	∅,∅	∅	534	∅	∅	∅,∅	∅	∅	∅	∅	∅
mill_0020,mcsanzhi,"agurre bursibcab itːi χːulatacːe iltːali, wallah hel ik'ʷiri, waˁħ hinra dikːantew ištːu bik'ul",#	0	ag-ur-re	#	b-urs-ib	ca-b	itːi	χːula-t-a-cːe	iltːa-li	#	wallah	hel	ik'ʷ-iri	#	waˁħ	0	hin	=ra	d-ikː-an-te	=w	ištːu	#	0	b-ik'-ul,#	0_boys	go.PFV-PRET-CVB	#	N-tell-PRET	be-N	3PL	big-PL-OBL-IN	3PL-ERG	#	by.God	that	say.IPFV-HAB.PST	#	wah	0	water	=and	NPL-want.IPFV-PTCP-ATTR.PL	=Q	here	#	0_builders	HPL-say.IPFV-ICVB,"They went away and told the elders. ""By God, (this is what) he said."" ""Wah, you need water here?"" they said.",en,MORPHEME_ALIGNED,,mill_mp3 mill_wav mill_eaf mill_xml mill_tsv,,140200,148222,#cv	0.h:s_ds_cv	v:pred	##	v:pred	rv_aux	dem_pro.h:g	other	dem_pro.h:a_ds	##ds	other	dem_pro.h:s_ds	v:pred	#ds_pc	other	0.h:ncs_pc	np:p	=other	v:pred	=other	other	#cv	0.h:s_ds_cv	v:pred,,mill,∅	510	∅	∅	∅	∅	534	∅	510	∅	∅	507	∅	∅	∅	501	536	∅	∅	∅	504	∅	534	∅,∅	510	∅	∅	∅	∅	534	∅	510	∅	∅	507	∅	∅	∅	501	536	∅	∅	∅	504	∅	534	∅,∅	∅	∅	∅	∅	∅	∅	∅	∅	∅	∅	∅	∅	∅	∅	∅	bridging	∅	∅	∅	∅	∅	∅	∅
mill_0021,mcsanzhi,"gurkabač'ible heltːi, barq'ibcab χːula erk'ʷlicːeb χːula erk'ʷla šːuleb urχːab",#	0	gu-r-ka-b-ač'-ib-le	#	hel-tːi	b-arq'-ib	ca-b	χːula	erk'ʷ-li-cːe-b	χːula	erk'ʷ-la	šːule-b	urχːab,#	0_builders	down-ABL-down-HPL-come.PFV-PRET-CVB	#	that-PL	N-do.PFV-PRET	be-N	big	river-OBL-IN-N	big	river-GEN	at.side-N	mill,"They went down, built the mill on the big river, next to the big river.",en,MORPHEME_ALIGNED,,mill_mp3 mill_wav mill_eaf mill_xml mill_tsv,,148222,158918,#cv	0.h:s_cv	v:pred	##	dem_pro:s	v:pred	rv_aux	nc	nc	ln_adj	ln_np:poss	np:l	np:p,,mill,∅	534	∅	∅	534	∅	∅	∅	∅	∅	516	517	515,∅	534	∅	∅	534	∅	∅	∅	∅	∅	516	517	515,∅	∅	∅	∅	∅	∅	∅	∅	∅	∅	bridging	bridging	new
mill_0022,mcsanzhi,"darq'ible har cik'al čula, buq'unnecab urχːab k'apːa barq'ib cabi",#	0	d-arq'-ib-le	har	cik'al	ču-la	#	b-uq'-un-ne	ca-b	urχːab	#	0	k'apːa	b-arq'-ib	cabi,#	0_builders	NPL-do.PFV-PRET-CVB	every	something	REFL.PL-GEN	#	N-mill.IPFV-ICVB-NC	be-N	mill	#	0_builders	NC	N-do.PFV-PRET	be<N>,"They built everything and their mill is working, they built the [UNCLEAR].",en,MORPHEME_ALIGNED,,mill_mp3 mill_wav mill_eaf mill_xml mill_tsv,,158918,169653,#cv	0.h:a_cv	v:pred	ln	indef_other:p	rn_refl.h:poss	#cv	v:pred	rv_aux	np:s_cv	#nc	nc_0.h	nc	nc	nc,,mill,∅	534	∅	∅	∅	534	∅	∅	∅	515	∅	534	∅	∅	∅,∅	534	∅	∅	∅	534	∅	∅	∅	515	∅	534	∅	∅	∅,∅	∅	∅	∅	∅	∅	∅	∅	∅	∅	∅	∅	∅	∅	∅
mill_0023,mcsanzhi,"muq'luq' barq'ib cabi, hitːi kaʁible rurgerrerguda hin buq'unnecab urχːab",#	0	muq'luq'	b-arq'-ib	cabi	#	hitːi	k-aʁ-ib-le	rurger-re-r	gu-d-a	hin	#	b-uq'-un-ne	ca-b	urχːab,#	0_builders	channel	N-do.PFV-PRET	be<N>	#	after	down-do.PFV-PRET-CVB	water.channel-SPR-ABL	down-NPL-SPR	water	#	N-mill.IPFV-ICVB-CVB	be-N	mill,"They built the channel, the water dropped down from the channel, the mill is milling.",en,MORPHEME_ALIGNED,,mill_mp3 mill_wav mill_eaf mill_xml mill_tsv,,169653,177702,##	0.h:a	np:p	v:pred	rv_aux	#cv	other	v:pred	np:obl	other:g	np:s	#cv	v:pred	rv_aux	np:s_cv,,mill,∅	534	518	∅	∅	∅	∅	∅	518	∅	519	∅	∅	∅	515,∅	534	518	∅	∅	∅	∅	∅	518	∅	519	∅	∅	∅	515,∅	∅	bridging	∅	∅	∅	∅	∅	∅	∅	bridging	∅	∅	∅	∅
mill_0024,mcsanzhi,"šːantalla deq'a delq'un cadi, tːura šːantalla delq'un cadi, na il kʷir kabirgulakːu urχːab, iltːaj balχul akːu hin čiriʁni",#	0	šːan-t-a-lla	deq'a	d-elq'-un	cadi	#	0	tːura	šːan-t-a-lla	d-elq'-un	cadi	#	na	il	kʷir	ka-b-irg-ul	akːu	urχːab	#	iltːa-j	b-alχ-ul	akːu	#	0	hin	čiriʁ-ni,#	0_mill	fellow.villager-PL-OBL-GEN	grain	NPL-mill.PFV-PRET	be<NPL>	#	0_mill	outside	fellow.villager-PL-OBL-GEN	NPL-mill.PFV-PRET	be<NPL>	#	now	that	stop	down-N-be.IPFV-ICVB	NEG	mill	#	3PL-DAT	N-know.IPFV-ICVB	NEG	#	0_people	water	close.IPFV-MSD,"The villagers mill their wheat, the people from other villages mill, now they cannot stop the mill, they do not know how to turn off the water.",en,MORPHEME_ALIGNED,,mill_mp3 mill_wav mill_eaf mill_xml mill_tsv,,177702,190316,##	0:a	ln_np.h:poss	np:p	v:pred	rv_aux	##	0:a	other	np:p	v:pred	rv_aux	#cv.neg	other	dem_pro:s_cps	other:lvc	v:pred	rv	np:dt_s	#cv.neg	dem_pro.h:ncs	v:pred	rv	#cc:p	0.h:a	np:p	v:pred,,mill,∅	515	501	502	∅	∅	∅	515	∅	520	∅	∅	∅	∅	515	∅	∅	∅	515	∅	501	∅	∅	∅	501	519	∅,∅	515	501	502	∅	∅	∅	515	∅	520	∅	∅	∅	∅	515	∅	∅	∅	515	∅	501	∅	∅	∅	501	519	∅,∅	∅	∅	∅	∅	∅	∅	∅	∅	new	∅	∅	∅	∅	∅	∅	∅	∅	∅	∅	∅	∅	∅	∅	∅	∅	∅
mill_0025,mcsanzhi,"na iltːi q'adnašːu, mallubnašːu baxulcab wallah nišːala urχːab hežitːe, kʷir kabirgul akːu buq'ancab pastajanna bik'ul",#	na	iltːi	q'ad-na-šːu	mallu-b-na-šːu	b-ax-ul	ca-b	#	wallah	nišːa-la	urχːab	hež-itːe	#	0	kʷir	ka-b-irg-ul	akːu	#	0	b-uq'-an	ca-b	pastajanna	#	0	b-ik'-ul,#	now	3PL	qadi-PL.OBL-ALLAT	mullah-PL-PL.OBL-ALLAT	HPL-go-ICVB	be-HPL	#	by.God	1PL-GEN	mill	this-ADVZ	#	0_mill	stop	down-N-be.IPFV-ICVB	NEG	#	0_mill	HPL-mill.IPFV-PTCP	be-HPL	always	#	0_people	HPL-say.IPFV-ICVB,"They go to the qadis, to the mullahs, ""By God, our mill is like this, it does not stop, it mills always,"" they say.",en,MORPHEME_ALIGNED,,mill_mp3 mill_wav mill_eaf mill_xml mill_tsv,,190316,202444,#cv	other	dem_pro.h:s	np.h:g	rn_np.h	v:pred	rv_aux	#ds_cv.neg	other	ln_pro.1:poss	np:s	other:pred	#ds_cv.neg	0:s_cps_cv	other:lvc	v:pred	rv	#ds_pc	0.h:s_cv	v:pred	rv_aux	other	#cv	0.h:s_ds_cv	v:pred,,mill,∅	∅	501	521	522	∅	∅	∅	∅	501	515	∅	∅	515	∅	∅	∅	∅	515	∅	∅	∅	∅	501	∅,∅	∅	501	521	522	∅	∅	∅	∅	501	515	∅	∅	515	∅	∅	∅	∅	515	∅	∅	∅	∅	501	∅,∅	∅	∅	new	new	∅	∅	∅	∅	∅	∅	∅	∅	∅	∅	∅	∅	∅	∅	∅	∅	∅	∅	∅	∅
mill_0026,mcsanzhi,"wallah, ik'ulcaw ca, hana karižib c'ikurili ik'ulcaw misa či bikːarre urχːab kʷirkabirganne",#	wallah	ik'-ul	ca-w	ca	#	#	#	hana	0	ka-r-iž-ib	%	c'ikuri-li	#	0	ik'-ul	ca-w	%	misa	=či	b-ikː-ar-re	%	urχːab	kʷir	ka-b-irg-an-ne,#	by.God	say.IPFV-ICVB	be-M	one	#	#	#	now	0_bride	down-F-sit.PFV-PRET	%	bride-ERG	#	0_he	say.IPFV-ICVB	be-M	%	mouth	=on	N-give.PFV-PRS-COND	%	mill	stop	down-N-be.IPFV-PTCP-PRS.3,"""By God,"" says one, ""a bride who just married, if she kisses the mill, it will stop.""",en,MORPHEME_ALIGNED,,mill_mp3 mill_wav mill_eaf mill_xml mill_tsv,,202444,214331,#cv	other	v:pred	rv_aux	np.h:s_ds_cv	##ds	#ds_ac	#ds_rc	other	rel_f0.h:s	v:pred	%	np.h:a	#cv	0.h:s_ds_cv	v:pred	rv_aux	%	np:obl	=adp	v:pred	%	np:s_cps	other:lvc	v:pred,,mill,∅	∅	∅	∅	523	∅	∅	∅	∅	533	∅	∅	533	∅	523	∅	∅	∅	∅	∅	∅	∅	515	∅	∅,∅	∅	∅	∅	523	∅	∅	∅	∅	533	∅	∅	533	∅	523	∅	∅	∅	∅	∅	∅	∅	515	∅	∅,∅	∅	∅	∅	bridging	∅	∅	∅	∅	new	∅	∅	∅	∅	∅	∅	∅	∅	∅	∅	∅	∅	∅	∅	∅
mill_0027,mcsanzhi,"wat', na iltːi il c'ikuri rarčːibcari, hana xadi karižibil, wallah hežitːe birq'ancab hežitːe, raše!",#	wat'	na	iltːi	il	c'ikuri	r-arčː-ib	cari	#	hana	0	xadi	ka-r-iž-ib-il	#	wallah	0	hež-itːe	b-irq'-an	ca-b	hež-itːe	#	0	r-aš-e,#	well	now	3PL	that	bride	F-find.PFV-PRET	be.F	#	now	0_bride	married	down-F-be.PFV-PRET-PTCP	#	by.God	0_we	this-ADVZ	N-do.IPFV-PTCP	be-N	this-ADVZ	#	0_bride	F-go-IMP,"Well, they found this bride who had only just married. ""By God, we have to do it like this, go!""",en,MORPHEME_ALIGNED,,mill_mp3 mill_wav mill_eaf mill_xml mill_tsv,,214331,226827,##	other	other	dem_pro.h:s	ln_dem	np.h:p	v:pred	rv_aux	#rc_pc	other	rel_f0.h:s_cps_pc	other:lvc	v:pred	#ds_pc	other	0.1:a_pc	other	v:pred	rv_aux	other	##ds	0.2:s	v:pred,,mill,∅	∅	∅	501	∅	524	∅	∅	∅	∅	524	∅	∅	∅	∅	537	∅	∅	∅	∅	∅	524	∅,∅	∅	∅	501	∅	524	∅	∅	∅	∅	524	∅	∅	∅	∅	537	∅	∅	∅	∅	∅	524	∅,∅	∅	∅	∅	∅	new	∅	∅	∅	∅	∅	∅	∅	∅	∅	bridging	∅	∅	∅	∅	∅	∅	∅
mill_0028,mcsanzhi,na hel rursːilijra balχulakːuq'al il urχːab ce cabel,#	na	hel	rursːi-li-j	=ra	b-alχ-ul	akːu	=q'al	#	il	urχːab	ce	ca-b	=el,#	now	that	girl-OBL-DAT	=and	N-know.IPFV-ICVB	NEG	=MOD	#	that	mill	what	be-N	=INDQ,The girl also does not know what a mill is.,en,MORPHEME_ALIGNED,,mill_mp3 mill_wav mill_eaf mill_xml mill_tsv,,226827,232996,#cv.neg	other	ln_dem	np.h:ncs	=other	v:pred	rv	=other	#cc:p	ln_dem	np:s	intrg_other:pred	cop	=other,,mill,∅	∅	∅	524	∅	∅	∅	∅	∅	∅	∅	∅	∅	∅,∅	∅	∅	524	∅	∅	∅	∅	∅	∅	∅	∅	∅	∅,∅	∅	∅	∅	∅	∅	∅	∅	∅	∅	∅	∅	∅	∅
mill_0029,mcsanzhi,agurre misa či bičːij raˁʡ čikaqiblecari heltːu qːuˁnqːuˁpːe bulan sarderqːibcad urχːabli buq'unne,#	0	ag-ur-re	#	#	0	misa	=či	b-ičː-ij	%	0	r-aˁʡ-čikaq-ib-le	cari	#	heltːu	qːuˁnqː-uˁpːe	bulan	sa-r-d-erqː-ib	ca-d	urχːab-li	#	0	b-uq'-un-ne,#	0_bride	go.PFV-PRET-CVB	#	#	0_bride	mouth	=on	N-give.PFV-INF1	%	0_bride	F-bend.PFV-PRET-CVB	be.F	#	there	nose-PL	even	ANTE-ABL-NPL-carry.PFV-PRET	be-NPL	mill-ERG	#	0_mill	N-turn.IPFV-ICVB-CVB,"She went there, bent forward to kiss the mill, while the millstone was turning, it even carried away her nose.",en,WORD_ALIGNED,,mill_mp3 mill_wav mill_eaf mill_xml mill_tsv,,232996,241960,#cv	0.h:s_ds_cv	v:pred	#cv	#ac_in	0.h:a_cps_in	other:lvc	=adp	v:pred	%	0.h:s_cv	v:pred	rv_aux	##	other	np:p	other	v:pred	rv_aux	np:a	#cv	0:s_cv	v:pred,,mill,∅	524	∅	∅	∅	524	∅	∅	∅	∅	524	∅	∅	∅	∅	525	∅	∅	∅	526	∅	515	∅,∅	524	∅	∅	∅	524	∅	∅	∅	∅	524	∅	∅	∅	∅	525	∅	∅	∅	526	∅	515	∅,∅	∅	∅	∅	∅	∅	∅	∅	∅	∅	∅	∅	∅	∅	∅	bridging	∅	∅	∅	bridging	∅	∅	∅
mill_0030,mcsanzhi,sar derqːibcad heltːi qːuˁnqːuˁpːe huja haraj risːul ʁaˁʁ rik'ul,#	0	sa-r-d-erqː-ib	ca-d	hel-tːi	qːuˁnqː-uˁpːe	#	0	huja	haraj	r-isː-ul	#	0	ʁaˁʁ	r-ik'-ul,#	0_millstone	ANTE-ABL-NPL-carry.PFV-PRET	be-NPL	that-PL	nose-PL	#	0_bride	wow	noise	F-cry-ICVB	#	0_bride	scream	F-say.IPFV-ICVB,"It carried away her nose [i.e. cut it off], she was crying and screaming.",en,MORPHEME_ALIGNED,,mill_mp3 mill_wav mill_eaf mill_xml mill_tsv,,241960,247191,##	0:a	v:pred	rv_aux	ln_dem	np:p	#cv	0.h:s_cps_cv	other	other:lvc	v:pred	#cv	0.h:s_ds_cps_cv	other:lvc	v:pred,,mill,∅	526	∅	∅	∅	525	∅	524	∅	∅	∅	∅	524	∅	∅,∅	526	∅	∅	∅	525	∅	524	∅	∅	∅	∅	524	∅	∅,∅	∅	∅	∅	∅	∅	∅	∅	∅	∅	∅	∅	∅	∅	∅
mill_0031,mcsanzhi,"c'ili iltːali kaqːible q'uˁq', χːula q'uˁq' kaqːible, paˁq bik'ul, paˁq bik'ul belq'unnecab hel urχːab",#	c'ili	iltːa-li	k-aqː-ib-le	q'uˁq'	#	0	χːula	q'uˁq'	k-aqː-ib-le	#	0	0	paˁq	b-ik'-ul	#	0	0	paˁq	b-ik'-ul	#	0	b-elq'-un-ne	ca-b	hel	urχːab,#	then	3PL-ERG	down-carry-PRET-CVB	hammer	#	0_people	big	hammer	down-carry-PRET-CVB	#	0_people	0_mill	strike	HPL-say.IPFV-ICVB	#	0_people	0_mill	strike	HPL-say.IPFV-ICVB	#	0_people	N-break.PFV-PRET-CVB	be-N	that	mill,"Then they brought a hammer, (they) brought a big hammer, struck the mill and destroyed it.",en,MORPHEME_ALIGNED,,mill_mp3 mill_wav mill_eaf mill_xml mill_tsv,,247191,258654,#cv	other	dem_pro.h:a_cv	v:pred	np:p	#cv	0.h:a_cv	ln_adj	np:p	v:pred	#cv	0.h:s_cpa_cv	0:p	other:lvc	v:pred	#cv	0.h:s_cpa_cv	0:p	other:lvc	v:pred	#cv	0.h:a_cv	v:pred	rv_aux	ln_dem	np:p,,mill,∅	∅	501	∅	527	∅	501	∅	527	∅	∅	501	526	∅	∅	∅	501	526	∅	∅	∅	501	∅	∅	∅	515,∅	∅	501	∅	527	∅	501	∅	527	∅	∅	501	526	∅	∅	∅	501	526	∅	∅	∅	501	∅	∅	∅	515,∅	∅	∅	∅	new	∅	∅	∅	∅	∅	∅	∅	∅	∅	∅	∅	∅	∅	∅	∅	∅	∅	∅	∅	∅	∅
mill_0032,mcsanzhi,urχːabla maˁχʷaˁra dužiblecadi darq'ibte hitːi kadirkan,#	urχːab-la	maˁχʷaˁra	d-už-ib-le	cadi	d-arq'-ib-te	hitːi	ka-d-irk-an,#	mill-GEN	NC	NPL-be-PRET-CVB	be<NPL>	NPL-do.PFV-PRET-ATTR.PL	after	down-NPL-occur.IPFV-PTCP,"The [UNCLEAR] of the mill that had been made, the ones that attach,",en,MORPHEME_ALIGNED,,mill_mp3 mill_wav mill_eaf mill_xml mill_tsv,,258654,268413,#nc	nc_np	nc	nc	nc	nc	nc	nc,,mill,∅	515	∅	∅	∅	∅	∅	∅,∅	515	∅	∅	∅	∅	∅	∅,∅	∅	∅	∅	∅	∅	∅	∅
