ID,Language_ID,Primary_Text,Analyzed_Word,Gloss,Translated_Text,Meta_Language_ID,LGR_Conformance,Comment,Media_IDs,Position,Audio_Start,Audio_End,graid,add_orthography,Text_ID,refind,refindFK,isnref
ramazan_0019,mcsanzhi,pasport čiwažaqible izwinitsja iχub c'il.,#	0	0	pasport	či-w-až-aq-ib-le	#	0	izwinitsja	iχ-ub	c'il,#	0_Tawlu	0_journalist	passport[R]	SPR-M-see.PFV-CAUS-PRET-CVB	#	0_journalist	apologize[R]	become.PFV-PRET	then,"(Tawlu) showed his passport (to the journalist), and then that (journalist) said sorry.",en,MORPHEME_ALIGNED,,ramazan_mp3 ramazan_wav ramazan_eaf ramazan_xml ramazan_tsv,,52307,54563,#cv	0.h:a_cv	0.h:obl	np:p	v:pred	##	0.h:s_cps	other:lvc	v:pred	other,,ramazan,∅	701	711	705	∅	∅	711	∅	∅	∅,∅	701	711	705	∅	∅	711	∅	∅	∅,∅	∅	∅	bridging	∅	∅	∅	∅	∅	∅
ramazan_0020,mcsanzhi,"du ʡaˁsi iχubda ik'ʷar, heχ Tawlu bik'ʷanqːella ik'ʷar.",#	du	ʡaˁsi	iχ-ub-da	#	0	ik'ʷ-ar	#	heχ	Tawlu	b-ik'ʷ-an	=qːella	#	0	ik'ʷ-ar,#	1SG	angry	be.PFV-PRET-1	#	0_journalist	say.IPFV-PRS	#	DEM.down	Tawlu	N-say.IPFV-PTCP	=when	#	0_journalist	say.IPFV-PRS,"""I got angry,"" he says, ""when you said this, Tawlu,"" he says.",en,MORPHEME_ALIGNED,,ramazan_mp3 ramazan_wav ramazan_eaf ramazan_xml ramazan_tsv,,54563,60176,##ds	pro.1:s_cps	other:lvc	v:pred	##	0.h:s_ds	v:pred	#ds_ac_pc	dem_pro:p	pn_np.h:s_ds	v:pred	=adp	##	0.h:s_ds	v:pred,,ramazan,∅	711	∅	∅	∅	711	∅	∅	706	701	∅	∅	∅	711	∅,∅	711	∅	∅	∅	711	∅	∅	706	701	∅	∅	∅	711	∅,∅	∅	∅	∅	∅	∅	∅	∅	bridging	∅	∅	∅	∅	∅	∅
ramazan_0021,mcsanzhi,nacijonalist gursajčible hel.,#	nacijonalist	gu-r-sa-jč-ib-le	hel,#	nationalist[R]	down-ABL-hither-occur.PFV-PRET-CVB	that,That [journalist] was a nationalist.,en,MORPHEME_ALIGNED,,ramazan_mp3 ramazan_wav ramazan_eaf ramazan_xml ramazan_tsv,,60176,63382,#cv	np.h:pred	cop	dem_pro.h:s_cv,,ramazan,∅	∅	∅	711,∅	∅	∅	711,∅	∅	∅	∅
ramazan_0022,mcsanzhi,helʁuna t'amahama agurtede Tawlulara heχilara.,#	hel	=ʁuna	t'amahama	ag-ur-te-de	Tawlu-la	=ra	heχ-i-la	=ra,#	that	=EQ	story	go.PFV-PRET-ATTR.PL-PST	Tawlu-GEN	=and	DEM.down-OBL-GEN	=and,A story like this happened to Tawlu and him.,en,MORPHEME_ALIGNED,,ramazan_mp3 ramazan_wav ramazan_eaf ramazan_xml ramazan_tsv,,63382,66052,##	ln_dem	=ln	np:s	v:pred	pn_np.h:obl	=rn	rn_dem_pro.h	=rn,,ramazan,∅	∅	∅	707	∅	701	∅	711	∅,∅	∅	∅	707	∅	701	∅	711	∅,∅	∅	∅	bridging	∅	∅	∅	∅	∅
ramazan_0023,mcsanzhi,heχ Tawlula har zamana dirχʷar t'amahama.,#	heχ	Tawlu-la	har	zamana	d-irχʷ-ar	t'amahama,#	DEM.down	Tawlu-GEN	every	time	NPL-become.IPFV-PRS	story,With Tawlu such stories always happen.,en,MORPHEME_ALIGNED,,ramazan_mp3 ramazan_wav ramazan_eaf ramazan_xml ramazan_tsv,,66052,68297,##	other	pn_np.h:obl	ln	np:other	v:pred	np:s,,ramazan,∅	∅	701	∅	∅	∅	708,∅	∅	701	∅	∅	∅	708,∅	∅	∅	∅	∅	∅	bridging
ramazan_0024,mcsanzhi,[INTERVIEWER TALK],NC,NC,[INTERVIEWER TALK],en,MORPHEME_ALIGNED,,ramazan_mp3 ramazan_wav ramazan_eaf ramazan_xml ramazan_tsv,,68297,74620,nc,,ramazan,∅,∅,∅
ramazan_0025,mcsanzhi,heštːu belk'ʷij bikːuldew at?,#	heštːu	0	b-elk'ʷ-ij	#	b-ikː-ul-de	=w	at,#	here	0_you	N-write.PFV-INF1	#	N-want.IPFV-ICVB-2SG	=Q	2SG.DAT,Do you want to record [lit. write] it here?,en,MORPHEME_ALIGNED,,ramazan_mp3 ramazan_wav ramazan_eaf ramazan_xml ramazan_tsv,,74620,75928,#nc	nc	nc_0.2	nc	#nc	nc	nc	nc,,ramazan,∅	∅	∅	∅	∅	∅	∅	∅,∅	∅	∅	∅	∅	∅	∅	∅,∅	∅	∅	∅	∅	∅	∅	∅
ramazan_0026,mcsanzhi,[INTERVIEWER TALK],NC,NC,[INTERVIEWER TALK],en,MORPHEME_ALIGNED,,ramazan_mp3 ramazan_wav ramazan_eaf ramazan_xml ramazan_tsv,,75928,78121,nc,,ramazan,∅,∅,∅
ramazan_0027,mcsanzhi,nu šest... lidilra ʡuˁmru ʁanu urekːra dusː tolko rabotal.,#	nu	0	šest	lidil	=ra	ʡuˁmru	ʁanu	urekː	=ra	dus	tolko	rabotal,#	well	0_I	six[R]	all<PL>	=and	life	twenty	six	=and	year	only[R]	worked[R],"Well six, all my life, 26 years I only worked.",en,MORPHEME_ALIGNED,,ramazan_mp3 ramazan_wav ramazan_eaf ramazan_xml ramazan_tsv,,78121,83986,#nc	nc	nc_0.1	nc	nc	nc	nc	nc	nc	nc	nc	nc	nc,,ramazan,∅	∅	700	∅	∅	∅	∅	∅	∅	∅	∅	∅	∅,∅	∅	700	∅	∅	∅	∅	∅	∅	∅	∅	∅	∅,∅	∅	bridging	∅	∅	∅	∅	∅	∅	∅	∅	∅	∅
ramazan_0028,mcsanzhi,ʁanu aʁʷra-xura dusː dalnobojšikom,#	ʁanu	aʁʷra-xura	dus	dalnobojšikom,#	twenty	four-five	year	lorry.driver[R],"24, 25 years as as a lorry driver.",en,MORPHEME_ALIGNED,,ramazan_mp3 ramazan_wav ramazan_eaf ramazan_xml ramazan_tsv,,83986,86794,#nc	nc	nc	nc	nc,,ramazan,∅	∅	∅	∅	∅,∅	∅	∅	∅	∅,∅	∅	∅	∅	∅
ramazan_0029,mcsanzhi,libillicːerka bah qːuʁace dunja kabicːuril dam dejstwitelno Latwijade.,#	libil-li-cːe-r-ka	bah	qːuʁa-ce	dunja	ka-b-icː-ur-il	dam	dejstwitelno	Latwija-de,#	all<N>-OBL-IN-ABL-down	most	beautiful-ATTR.SG	world	down-N-stand.PFV-PRET-PTCP	1SG.DAT	really[R]	Latvia-PST,Among all the most beautiful (country) in the world seemed to me Latvia.,en,MORPHEME_ALIGNED,,ramazan_mp3 ramazan_wav ramazan_eaf ramazan_xml ramazan_tsv,,86794,90858,##	np:other	ln	np:s_pc	rn_np	other	pro.1:obl	other	pn_np:pred,,ramazan,∅	∅	∅	709	710	∅	700	∅	712,∅	∅	∅	709	710	∅	700	∅	712,∅	∅	∅	new	unused	∅	∅	∅	bridging
ramazan_0030,mcsanzhi,"Latwija, Estonija... [CROSSTALK] kːalkme duqente",#	Latwija	Estonija	NC	kːalk-me	d-uqen-te,#	Latvia	Estonia	NC	tree-PL	NPL-long-ATTR.PL,"Latvia, Estonia,... tall trees.",en,MORPHEME_ALIGNED,,ramazan_mp3 ramazan_wav ramazan_eaf ramazan_xml ramazan_tsv,,90858,96546,#nc	nc	nc	nc	nc	nc,,ramazan,∅	712	785	∅	∅	∅,∅	712	785	∅	∅	∅,∅	∅	bridging	∅	∅	∅
ramazan_0031,mcsanzhi,c'idex wac'acːed kusa dikːuldel.,#	c'idex	wac'a-cːe-d	kusa	0	d-ikː-ul-del,#	fruit	forest-IN-NPL	how.much	0	NPL-want.IPFV-ICVB-COND.PST,Fruit in the forests however much you wanted.,en,MORPHEME_ALIGNED,,ramazan_mp3 ramazan_wav ramazan_eaf ramazan_xml ramazan_tsv,,96546,98946,##	np:p	rn_np	other	0.h:ncs	v:pred,,ramazan,∅	713	714	∅	∅	∅,∅	713	714	∅	∅	∅,∅	new	bridging	∅	∅	∅
ramazan_0032,mcsanzhi,c'aq'le balbičib musːa.,#	0	c'aq'-le	b-al	b-ič-ib	musːa,#	0_Latvia	very-ADVZ	N-fit	N-occur.PFV-PRET	place,(Latvia was) a very fitting [= good] place.,en,MORPHEME_ALIGNED,,ramazan_mp3 ramazan_wav ramazan_eaf ramazan_xml ramazan_tsv,,98946,100364,##	0:s	ln	ln_adj	cop	np:pred,,ramazan,∅	712	∅	∅	∅	∅,∅	712	∅	∅	∅	∅,∅	∅	∅	∅	∅	∅
ramazan_0033,mcsanzhi,"i xun,... amzudex, krasota, xunra",#	i	xun	amzu-dex	krasota	xun	=ra,#	and	road	clean-NMLZ	beauty[R]	road	=and,"And the roads, order, beauty, and the roads!",en,MORPHEME_ALIGNED,,ramazan_mp3 ramazan_wav ramazan_eaf ramazan_xml ramazan_tsv,,100364,104895,#nc	nc	nc	nc	nc	nc	nc,,ramazan,∅	∅	∅	∅	∅	∅	∅,∅	∅	∅	∅	∅	∅	∅,∅	∅	∅	∅	∅	∅	∅
ramazan_0034,mcsanzhi,"hetːu wituqunqːella Latwijalcːe plitačnyj xunbe, dam hanbičib na libil mašin dila parapara habirkanne ik'ul",#	#	hetːu	0	w-ituq-un	=qːella	Latwija-l-cːe	%	plitačnyj	xun-be	#	dam	han	b-ič-ib	na	libil	#	mašin	di-la	parapara	ha-b-irk-an-ne	ik'-ul,#	#	there	0_I	M-cross.PFV-PRET	=when-OBL-IN	Latvia-OBL-IN	%	slabbed[R]	road-PL	#	1SG.DAT	remember	N-occur.PFV-PRET	now	all<N>	#	car	1SG-GEN	parapara	upwards-N-occur.IPFV-PTCP-PRS.3	say.IPFV-ICVB,"When I arrived there in Latvia, there were slabbed roads, I remember now, my car made 'parapara' (= sound),",en,WORD_ALIGNED,,ramazan_mp3 ramazan_wav ramazan_eaf ramazan_xml ramazan_tsv,,104895,111400,##	#ac	other	0.1:s	v:pred	=adp	pn_np:g	%	ln_adj	np:pred	##	pro.1:ncs_cpa	other:lvc	v:pred	other	np:p	#cv	np:s_ds	rn_pro.1:poss	other	v:pred	rv_v,,ramazan,∅	∅	712	700	∅	∅	712	∅	∅	715	∅	700	∅	∅	∅	∅	∅	716	700	∅	∅	∅,∅	∅	712	700	∅	∅	712	∅	∅	715	∅	700	∅	∅	∅	∅	∅	716	700	∅	∅	∅,∅	∅	∅	∅	∅	∅	∅	∅	∅	new	∅	∅	∅	∅	∅	∅	∅	bridging	∅	∅	∅	∅
ramazan_0035,mcsanzhi,čikabarc'ur xunne šik-šik t'amacːella wabše laˁʁunce awadance xun.,#	0	či-ka-b-arc'-ur	xun-ne	šikšik	t'ama-cːella	#	wabše	laˁʁun-ce	awadan-ce	xun,#	0_car	SPR-down-N-stick.to.PFV-PRET	road-SPR	shikshik	sound-COMIT	#	at.all	smooth-ATTR.SG	no.problem-ATTR.SG	road,"(My car) stuck to the road with a shikshik sound, it went very well without problem.",en,MORPHEME_ALIGNED,,ramazan_mp3 ramazan_wav ramazan_eaf ramazan_xml ramazan_tsv,,111400,119377,##	0:s	v:pred	np:l	ln	np:other	#nc	nc	nc	nc	nc_np,,ramazan,∅	716	∅	715	∅	∅	∅	∅	∅	∅	715,∅	716	∅	715	∅	∅	∅	∅	∅	∅	715,∅	∅	∅	∅	∅	∅	∅	∅	∅	∅	∅
ramazan_0036,mcsanzhi,hak'bulqunne akːʷi mašina,#	hak'	b-ulq-un-ne	akːʷ-i	mašina,#	jog	N-shiver.IPFV-ICVB-NC	NEG-HAB.PST	car,The car did not shake.,en,MORPHEME_ALIGNED,,ramazan_mp3 ramazan_wav ramazan_eaf ramazan_xml ramazan_tsv,,119377,121384,##neg	other:lvc	v:pred	rv_aux	np:s_cps,,ramazan,∅	∅	∅	∅	716,∅	∅	∅	∅	716,∅	∅	∅	∅	∅
ramazan_0037,mcsanzhi,šaharricːed swetaforte dakːʷi.,#	šahar-ri-cːe-d	swetafor-te	d-akːʷ-i,#	town-OBL-IN-NPL	traffic.light[R]-PL	NPL-NEG-HAB.PST,In the towns there were no traffic lights.,en,MORPHEME_ALIGNED,,ramazan_mp3 ramazan_wav ramazan_eaf ramazan_xml ramazan_tsv,,121384,123177,##neg	np:l	np:s	other:predex,,ramazan,∅	717	718	∅,∅	717	718	∅,∅	bridging	bridging	∅
ramazan_0038,mcsanzhi,"k'ʷel admi can bikardel... ʡaˁb admi xunna baʔle, t'aškaʁible mašinte propuskat birq'ulde hetːi χalq' ciwilizacija heltːub",#	#	k'ʷel	admi	can	b-ik-ar-del	#	ʡaˁb	admi	xun-na	baʔ-le	%	t'aš	k-aʁ-ib-le	mašin-te	#	0	propuskat	b-irq'-ul-de	hetːi	χalq'	#	ciwilizacija	heltːu-b,#	#	two	person	meet	N-occur.PFV-PRS-COND.PST	#	three	person	road-GEN	end-SPR	%	stop	down-do.PFV-PRET-CVB	car-PL	#	0_cars	let.pass[R]	HPL-do.IPFV-ICVB-PST	those	people	#	civilization[R]	there-N,"If two people meet, three people were on the side of the road, the cars stopped and let these people go, there was civilization there.",en,MORPHEME_ALIGNED,,ramazan_mp3 ramazan_wav ramazan_eaf ramazan_xml ramazan_tsv,,123177,132316,##	#ac	ln_num	np.h:s_cps	other:lvc	v:pred	#ac	ln_num	np.h:s_cv	ln_np:poss	np:pred_l	%	other:lvc	v:pred	np.h:s_cps	##	0.h:a_cpa	other:lvc	v:pred	ln_dem	np.h:p	##	np:s	other:l,,ramazan,∅	∅	∅	719	∅	∅	∅	∅	720	∅	721	∅	∅	∅	719	∅	719	∅	∅	∅	720	∅	∅	∅,∅	∅	∅	719	∅	∅	∅	∅	720	∅	721	∅	∅	∅	719	∅	719	∅	∅	∅	720	∅	∅	∅,∅	∅	∅	new	∅	∅	∅	∅	new	∅	bridging	∅	∅	∅	∅	∅	∅	∅	∅	∅	∅	∅	∅	∅
ramazan_0039,mcsanzhi,wot.,wot,well,Well...,en,MORPHEME_ALIGNED,,ramazan_mp3 ramazan_wav ramazan_eaf ramazan_xml ramazan_tsv,,132316,132913,other,,ramazan,∅,∅,∅
ramazan_0040,mcsanzhi,c'ili daˁrχaˁlla dučːi qiliw kelgunda nu hetːu... witulqanqːella Latwijalcːe aswalt'la but'a sitːa aswalt'ler habertːible čibaˁqibda het,#	c'ili	0	daˁrχaˁlla	dučːi	qili-w	kelg-un-da	nu	hetːu	#	#	0	w-it-ulq-an	=qːella	Latwija-l-cːe	%	0	aswalt'-la	but'a	sitːa	aswalt'-le-r	ha-b-ertː-ib-le	#	0	či-b-aˁq-ib-da	het,#	then	0_I	dinner	night	home-M	remain.PFV-PRET-1	well	there	#	#	0_I	M-thither-direct.IPFV-PTCP	=when	Latvia-OBL-IN	%	0_I	asphalt[R]-GEN	piece	chewing.gum	asphalt[R]-SPR-ABL	upwards-N-take.PFV-PRET-CVB	#	0_I	SPR-N-hit.PFV-PRET-1	that,"Then I stayed there at a house, well, there, when I arrived in Latvia, pieces of asphalt and chewing gum flew up from the asphalt [= because I drove so fast, because the roads were good]; I hit on the road [= drove fast].",en,MORPHEME_ALIGNED,,ramazan_mp3 ramazan_wav ramazan_eaf ramazan_xml ramazan_tsv,,132913,141385,##	other	0.1:s	np:other	np:other	np:l	v:pred	other	other	#cv	#ac_pc	0.1:s_pc	v:pred	=adp	pn_np:l	%	0.1:a_cv	ln_np:poss	np:p	rn_np	np:obl	v:pred	##	0.1:a	v:pred	dem_pro:p,,ramazan,∅	∅	700	∅	∅	722	∅	∅	∅	∅	∅	700	∅	∅	712	∅	700	∅	723	724	725	∅	∅	700	∅	∅,∅	∅	700	∅	∅	722	∅	∅	∅	∅	∅	700	∅	∅	712	∅	700	∅	723	724	725	∅	∅	700	∅	∅,∅	∅	∅	∅	∅	new	∅	∅	∅	∅	∅	∅	∅	∅	∅	∅	∅	∅	new	new	bridging	∅	∅	∅	∅	∅
ramazan_0041,mcsanzhi,"D bukwala daglicːe, ul, daglicːe q'ut'čibitarq'ibda sala.",#	D	bukwa-la	d-ag-li-cːe	u-l	d-ag-li-cːe	q'ut'	či-b-it-arq'-ib-da	sala,#	D	letter[R]-GEN	NPL-middle-OBL-IN	2SG-ERG	NPL-middle-OBL-IN	knock	SPR-N-thither-do.PFV-PRET-1	front,"In the middle (of the plates) you put the letter D, in front.",en,MORPHEME_ALIGNED,,ramazan_mp3 ramazan_wav ramazan_eaf ramazan_xml ramazan_tsv,,141385,146025,##	np:p	rn_np:poss	np:other	pro.2:a_cpa	np:l	other:lvc	v:pred	np:l,,ramazan,∅	727	∅	∅	726	728	∅	∅	729,∅	727	∅	∅	726	728	∅	∅	729,∅	new	∅	∅	bridging	bridging	∅	∅	bridging
ramazan_0042,mcsanzhi,hetːu čiwitagurdaj t'ašaaʁibda calli alrah,#	hetːu	0	či-w-it-ag-ur-daj	#	0	t'aš	a-aʁ-ib-da	ca-l-li	alrah,#	there	0_I	SPR-M-thither-go.PFV-PRET-NC	#	0_I	stop	NEG-do.PFV-PRET-1	one-OBL-ERG	at.least,"Before arriving there, not even one (person) stopped me.",en,MORPHEME_ALIGNED,"[DF: HM says that ""čiwitagurdaj"" is an Icari form, it should be ""чивитегъий"" in Sanzhi; the suffix ""-daj"" is probably not Sanzhi, but the verb stem should be Sanzhi.]",ramazan_mp3 ramazan_wav ramazan_eaf ramazan_xml ramazan_tsv,,146025,148719,#nc	nc	nc_0.1:s	nc	##neg	0.1:p	other:lvc	v:pred	indef_other.h:a_cpa	other,,ramazan,∅	∅	700	∅	∅	700	∅	∅	∅	∅,∅	∅	700	∅	∅	700	∅	∅	∅	∅,∅	∅	∅	∅	∅	∅	∅	∅	∅	∅
ramazan_0043,mcsanzhi,cellij akːun latjšskij nomerte pod nix proexalsja helʁuna q'ʷila-q'ʷila ʡaˁmalte kam adirχʷi dila,#	cellij	akːu	=n	latjšskij	nomer-te	pod	nix	proexalsja	#	hel	=ʁuna	q'ʷila-q'ʷila	ʡaˁmal-te	kam	a-d-irχʷ-i	di-la,#	why	NEG	=but	Latvian[R]	number[R]-PL	under[R]	them[R]	drove[R]	#	that	=EQ	a.little-a.little	talent-PL	little	NEG-NPL-become.IPFV-HAB.PST	1SG-GEN,"Because the Latvian plate, I drove with it, like this without a little trick I cannot be.",en,MORPHEME_ALIGNED,DF: interrogative pronoun as indefinite.,ramazan_mp3 ramazan_wav ramazan_eaf ramazan_xml ramazan_tsv,,148719,156483,#nc	nc	nc	nc	nc	nc	nc	nc	nc	##neg	dem_pro:other	=other	other	np:s	rn_adj	v:pred	pro.1:obl,,ramazan,∅	∅	∅	∅	∅	∅	∅	∅	∅	∅	∅	∅	∅	730	∅	∅	700,∅	∅	∅	∅	∅	∅	∅	∅	∅	∅	∅	∅	∅	730	∅	∅	700,∅	∅	∅	∅	∅	∅	∅	∅	∅	∅	∅	∅	∅	bridging	∅	∅	∅
ramazan_0044,mcsanzhi,dučːi sajʁibqːella ʡurus xunulla qili xuradiχubda nušːa.,#	#	dučːi	0	sa-jʁ-ib	=qːella	ʡuˁrus	xunul-la	qili	%	xura	d-iχ-ub-da	nušːa,#	#	night	0_I	hither-come.PFV-PRET	=when	Russian	woman-GEN	home	%	relax	1/2PL-be.PFV-PRET-1	1PL,"At night when I arrived at the house of a Russian woman, we slept there.",en,MORPHEME_ALIGNED,,ramazan_mp3 ramazan_wav ramazan_eaf ramazan_xml ramazan_tsv,,156483,163155,##	#ac	np:other	0.1:s	v:pred	=adp	ln_adj	ln_np.h:poss	np:g	%	other:lvc	v:pred	pro.1:s_cps,,ramazan,∅	∅	∅	700	∅	∅	∅	731	722	∅	∅	∅	732,∅	∅	∅	700	∅	∅	∅	731	722	∅	∅	∅	732,∅	∅	∅	∅	∅	∅	∅	new	∅	∅	∅	∅	bridging
ramazan_0045,mcsanzhi,polnoč saˁʡaˁt ca dičible dučːilla sajʁibcede du.,#	#	polnoč	sːaˁʡaˁt	ca	d-ič-ib-le	dučːi-lla	%	sa-jʁ-ib-ce-de	du,#	#	midnight[R]	hour	one	NPL-occur.PFV-PRET-CVB	night-GEN	%	hither-come.PFV-PRET-ATTR.SG-PST	1SG,"At midnight, at one o'сlock at night I arrived.",en,MORPHEME_ALIGNED,,ramazan_mp3 ramazan_wav ramazan_eaf ramazan_xml ramazan_tsv,,163155,165548,##	#cv	np:other	np:s	rn	v:pred	np:other	%	v:pred	pro.1:s,,ramazan,∅	∅	∅	∅	∅	∅	∅	∅	∅	700,∅	∅	∅	∅	∅	∅	∅	∅	∅	700,∅	∅	∅	∅	∅	∅	∅	∅	∅	∅
ramazan_0046,mcsanzhi,mašin kabaturre hajʁi k'ʷi dičib,#	0	mašin	ka-b-at-ur-re	#	0	ha-jʁ-i	#	k'ʷi	d-ič-ib,#	0_I	car	down-N-let.PFV-PRET-CVB	#	0_I	upwards-come.PFV-HAB.PST	#	two	NPL-occur.PFV-PRET,When I parked the car and entered the house it was already 2 o'clock.,en,MORPHEME_ALIGNED,,ramazan_mp3 ramazan_wav ramazan_eaf ramazan_xml ramazan_tsv,,165548,167537,#cv	0.1:a_cv	np:p	v:pred	##	0.1:s	v:pred	##	np:s	v:pred,,ramazan,∅	700	716	∅	∅	700	∅	∅	∅	∅,∅	700	716	∅	∅	700	∅	∅	∅	∅,∅	∅	∅	∅	∅	∅	∅	∅	∅	∅
ramazan_0047,mcsanzhi,wagla qar amzu warq'ible wircible het xunulli du.,#	0	w-ag-la	qar	amzu	w-arq'-ib-le	#	w-irc-ib-le	het	xunul-li	du,#	0_host	M-waist-GEN	up	clean	M-do.PFV-PRET-CVB	#	M-wash.PFV-PRET-CVB	that	woman-ERG	1SG,"(She) cleaned my upper body, that woman washed me,",en,MORPHEME_ALIGNED,,ramazan_mp3 ramazan_wav ramazan_eaf ramazan_xml ramazan_tsv,,167537,170094,#cv	0.h:a_cpa_cv	ln_np:poss	np:p	other:lvc	v:pred	#cv	v:pred	ln_dem	np.h:a	pro.1:p,,ramazan,∅	731	∅	733	∅	∅	∅	∅	∅	731	700,∅	731	∅	733	∅	∅	∅	∅	∅	731	700,∅	∅	∅	bridging	∅	∅	∅	∅	∅	∅	∅
ramazan_0048,mcsanzhi,waχːunne daˁrχaˁlla.,#	0	0	w-aχː-un-ne	daˁrχaˁlla,#	0_host	0_I	M-feed.PFV-PRET-CVB	dinner,"(she) made me dinner,",en,MORPHEME_ALIGNED,,ramazan_mp3 ramazan_wav ramazan_eaf ramazan_xml ramazan_tsv,,170094,171085,#cv	0.h:a_cv	0.1:g	v:pred	np:p,,ramazan,∅	731	700	∅	∅,∅	731	700	∅	∅,∅	∅	∅	∅	∅
ramazan_0049,mcsanzhi,kʷir warq'ibda.,#	0	0	kʷi-r	w-arq'-ib-da,#	0_host	0_I	in.the.hands-ABL	M-do.PFV-PRET-1,and put me to bed.,en,MORPHEME_ALIGNED,"DF: HM says that he would rather say ""kʷir kajsaqunda"" 'put to sleep, lay down'.",ramazan_mp3 ramazan_wav ramazan_eaf ramazan_xml ramazan_tsv,,171085,172013,##	0.h:a	0.1:p	np:obl	v:pred,,ramazan,∅	731	700	∅	∅,∅	731	700	∅	∅,∅	∅	∅	∅	∅
ramazan_0050,mcsanzhi,čːaˁʡaˁlla saˁʡaˁt wec'nu cara dikaraj usːunne kelgunda du.,#	#	čːaˁʡaˁl-la	sːaˁʡaˁt	wec'-nu	ca-ra	d-ik-ar-aj	%	usː-un-ne	kelg-un-da	du,#	#	morning-GEN	hour	ten-tenth	one-NUM	NPL-occur.PFV-PRS-INF2.3	%	sleep.PFV-PRET-CVB	remain.PFV-PRET-1	1SG,"In the morning, I slept until 11.",en,MORPHEME_ALIGNED,,ramazan_mp3 ramazan_wav ramazan_eaf ramazan_xml ramazan_tsv,,172013,174440,##	#ac_in	ln_np:poss	np:s_in	rn	rn	v:pred	%	v:pred	rv_v	pro.1:s,,ramazan,∅	∅	∅	∅	∅	∅	∅	∅	∅	∅	700,∅	∅	∅	∅	∅	∅	∅	∅	∅	∅	700,∅	∅	∅	∅	∅	∅	∅	∅	∅	∅	∅
ramazan_0051,mcsanzhi,čisalhunqːella insan wakːʷi qiliw,#	#	0	či-s-alh-un	=qːella	%	insan	w-akːʷ-i	qili-w,#	#	0_I	SPR-hither-wake.up.PFV-PRET	=when	%	person	M-NEG-HAB.PST	home-M,"When I woke up, there was nobody at home.",en,MORPHEME_ALIGNED,,ramazan_mp3 ramazan_wav ramazan_eaf ramazan_xml ramazan_tsv,,174440,176895,##neg	#ac	0.1:s	v:pred	=adp	%	np.h:s	other:predex	np:l,,ramazan,∅	∅	700	∅	∅	∅	∅	∅	722,∅	∅	700	∅	∅	∅	∅	∅	722,∅	∅	∅	∅	∅	∅	∅	∅	∅
ramazan_0052,mcsanzhi,"lakkadarq'ible murhe led, celled čid, trilaˁžledčid.",#	#	0	lak	ka-d-arq'-ib-le	%	murhe	le-d	cel-le-d	či-d	trilaˁž-le-d	=či-d,#	#	0_gold	throw	down-NPL-do.PFV-PRET-CVB	%	gold	exist-NPL	what.OBL-SPR-NPL	SPR-NPL	dressing.table-SPR-NPL	=on-NPL,"The gold was lying around, everything was there on that what's-its-face, on the dressing table [i.e. all her jewelry was lying out in the open].",en,MORPHEME_ALIGNED,,ramazan_mp3 ramazan_wav ramazan_eaf ramazan_xml ramazan_tsv,,176895,180924,##	#cv	0:p	other:lvc	v:pred	%	np:s	other:predex	nc	nc	np:l	=adp,,ramazan,∅	∅	734	∅	∅	∅	734	∅	∅	∅	735	∅,∅	∅	734	∅	∅	∅	734	∅	∅	∅	735	∅,∅	∅	new	∅	∅	∅	∅	∅	∅	∅	new	∅
ramazan_0053,mcsanzhi,"c'il acːe bursille t'upːugle, qulexme lidil cik'al daqil lette.",#	c'il	a-cːe	b-urs-ille	#	t'upːugle	qulex-me	lidil	cik'al	d-aqil	le-t-te,#	then	2SG-IN	N-tell-COND.1.PRS	#	ring.PL	bracelet-PL	all<PL>	thing	NPL-much	exist-PL-PST,"Then, if I tell you, rings, bracelets, everything, many things were there.",en,MORPHEME_ALIGNED,,ramazan_mp3 ramazan_wav ramazan_eaf ramazan_xml ramazan_tsv,,180924,185615,#nc	nc	nc_pro.2	nc	##	np:s	rn_np	rn	rn_np	other	other:predex,,ramazan,∅	∅	736	∅	∅	737	738	∅	739	∅	∅,∅	∅	736	∅	∅	737	738	∅	739	∅	∅,∅	∅	bridging	∅	∅	new	new	∅	new	∅	∅
ramazan_0054,mcsanzhi,arc lette kadišːible heltːud,#	arc	le-t-te	#	0	ka-d-išː-ib-le	heltːu-d,#	money	exist-PL-PST	#	0_money	down-NPL-put.PFV-PRET-CVB	there-NPL,"There was money, (money) was placed there.",en,MORPHEME_ALIGNED,,ramazan_mp3 ramazan_wav ramazan_eaf ramazan_xml ramazan_tsv,,185615,187792,##	np:s	other:predex	#cv	0:p	v:pred	other:l,,ramazan,∅	740	∅	∅	740	∅	735,∅	740	∅	∅	740	∅	735,∅	new	∅	∅	∅	∅	∅
ramazan_0055,mcsanzhi,nu libil cinna leb dawla-mas leb lak'sakabarq'ible heltːusa.,#	nu	libil	cin-na	le-b	#	dawla-mas	le-b	#	0	lak'	sa-ka-b-arq'-ib-le	heltːu-sa,#	well	all<N>	REFL.SG-GEN	exist-N	#	wealth-NC	exist-N	#	0_things	throw	hither-down-N-do.PFV-PRET-CVB	there-ANTE,"Well, all of her (things) were there, (her) wealth was there, (her things) were thrown about there.",en,MORPHEME_ALIGNED,,ramazan_mp3 ramazan_wav ramazan_eaf ramazan_xml ramazan_tsv,,187792,191851,##	other	np:s	rn_refl:poss	other:predex	##	np:s	other:predex	#cv	0.h:p	other:lvc	v:pred	other:l,,ramazan,∅	∅	∅	731	∅	∅	741	∅	∅	741	∅	∅	∅,∅	∅	∅	731	∅	∅	741	∅	∅	741	∅	∅	∅,∅	∅	∅	∅	∅	∅	bridging	∅	∅	∅	∅	∅	∅
ramazan_0056,mcsanzhi,"helij qːaʁ iχubda, baˁħ iχubda čak'al wakːu qiliw ja guppaturre qal guražij bala, biʡaˁn hasːar ja cik'al",#	hel-i-j	0	qːaʁ	iχ-ub-da	#	0	baˁħ	iχ-ub-da	#	ča-k'al	w-akːu	qili-w	#	ja	0	gu-p-p-at-ur-re	qal	#	0	gu-r-až-ij	bala	#	0	b-iʡ-aˁn	h-asː-ar	ja	cik'al,#	that-OBL-DAT	0_I	unconscious	be.PFV-PRET-1	#	0_I	crazy	be.PFV-PRET-1	#	who-INDEF	M-NEG	home-M	#	neither	0_I	down-N-N-let.PFV-PRET-CVB	house	#	0_I	down-ABL-see.PFV-INF1	misfortune	#	0	N-steal.PFV-PTCP	upwards-take.PFV-COND.3	neither	something,"About this I lost my mind, I went crazy [because I couldn't believe people would just leave their stuff around and not lock their houses], nobody was at home; neither could I leave the house [like this], I would be sad if somebody stole something.",en,MORPHEME_ALIGNED,,ramazan_mp3 ramazan_wav ramazan_eaf ramazan_xml ramazan_tsv,,191851,198731,##	dem_pro:obl	0.1:s	other:pred	cop	##	0.1:s	other:pred	cop	##neg	indef_other.h:s	cop	np:pred_l	#cv	other	0.1:a_cv	v:pred	np:p	#ac_in	0.1:ncs_in	v:pred	np:p	#ac	0.h:a	lv	v:pred	other	indef_other:p,,ramazan,∅	742	700	∅	∅	∅	700	∅	∅	∅	∅	∅	722	∅	∅	700	∅	722	∅	700	∅	∅	∅	∅	∅	∅	∅	∅,∅	742	700	∅	∅	∅	700	∅	∅	∅	∅	∅	722	∅	∅	700	∅	722	∅	700	∅	∅	∅	∅	∅	∅	∅	∅,∅	bridging	∅	∅	∅	∅	∅	∅	∅	∅	∅	∅	∅	∅	∅	∅	∅	∅	∅	∅	∅	∅	∅	∅	∅	∅	∅	∅
ramazan_0057,mcsanzhi,"meχ dakːu, cadaalra uncːala hitːi kaburqaˁnra bakːu qːapu ja tːurarka ja barklerka.",#	meχ	d-akːu	#	cada	=al	=ra	uncːa-la	hitːi	0	ka-b-urq-aˁn	=ra	#	b-akː-u	qːapu	ja	tːura-rka	ja	b-ark-le-r-ka,#	iron	NPL-NEG	#	one.NHPL	=INDQ	=and	door-GEN	behind	0_lock	down-N-hit.IPFV-PTCP	=and	#	N-NEG-PRS	gate	neither	outside-ABL	neither	N-inside-SPR-ABL-down,"There was no lock. There wasn't even a lock in one door, neither from the outside nor from the inside.",en,MORPHEME_ALIGNED,,ramazan_mp3 ramazan_wav ramazan_eaf ramazan_xml ramazan_tsv,,198731,204158,##neg	np:s	other:predex	#pc	ln_num	=other	=other	np:l	adp	0:s_pc	v:pred	=other	##neg	other:predex	np:s	other	other:obl	other	other:l,,ramazan,∅	743	∅	∅	∅	∅	∅	∅	∅	∅	∅	∅	∅	∅	∅	∅	∅	∅	∅,∅	743	∅	∅	∅	∅	∅	∅	∅	∅	∅	∅	∅	∅	∅	∅	∅	∅	∅,∅	bridging	∅	∅	∅	∅	∅	∅	∅	∅	∅	∅	∅	∅	∅	∅	∅	∅	∅
ramazan_0058,mcsanzhi,"ca zunrašːu agurda, k'ʷiibil, ʡaˁbibil zunra rarčːibda.",#	ca	zunra-šːu	0	ag-ur-da	k'ʷi-ibil	ʡaˁb-ibil	zunra	#	0	0	r-arčː-ib-da,#	one	neighbour-ALLAT	0_I	go.PFV-PRET-1	two-ORD	three-ORD	neighbour	#	0_I	0_host	F-find.PFV-PRET-1,"I went to one neighbour, to the second, to the third neighbour, I found her.",en,MORPHEME_ALIGNED,,ramazan_mp3 ramazan_wav ramazan_eaf ramazan_xml ramazan_tsv,,204158,206597,##	ln_deti	np.h:g	0.1:s	v:pred	ln_adj	ln_adj	np.h:g	##	0.1:ncs	0.h:p	v:pred,,ramazan,∅	∅	744	700	∅	∅	∅	745	∅	700	731	∅,∅	∅	744	700	∅	∅	∅	745	∅	700	731	∅,∅	∅	bridging	∅	∅	∅	∅	bridging	∅	∅	∅	∅
ramazan_0059,mcsanzhi,"hačible čidažaqibda lidil heltːi, it urk' ruqun",#	0	0	ha-č-ib-le	#	0	0	či-d-až-aq-ib-da	lidil	hel-tːi	#	it	urk'	r-uq-un,#	0_I	0_host	upwards-lead.PFV-PRET-CVB	#	0_I	0_host	SPR-NPL-see.PFV-CAUS-PRET-1	all<PL>	that-PL	#	that	wondering	F-go.PFV-PRET,I took her home and showed her everything. She was confused.,en,MORPHEME_ALIGNED,,ramazan_mp3 ramazan_wav ramazan_eaf ramazan_xml ramazan_tsv,,206597,209356,#cv	0.1:a_cv	0.h:p	v:pred	##	0.1:a	0.h:obl	v:pred	ln	dem_pro:p	##	dem_pro.h:s_cps	other:lvc	v:pred,,ramazan,∅	700	731	∅	∅	700	731	∅	∅	741	∅	731	∅	∅,∅	700	731	∅	∅	700	731	∅	∅	741	∅	731	∅	∅,∅	∅	∅	∅	∅	∅	∅	∅	∅	∅	∅	∅	∅	∅
ramazan_0060,mcsanzhi,hešːt... nišːala heštːub bilʡaˁn wakːu rik'ʷar.,#	hešːt	nišː-ala	heštːu-b	b-ilʡ-aˁn	w-akːu	#	0	r-ik'ʷ-ar,#	NC	1PL-GEN	here-N	N-steal.IPFV-PTCP	M-NEG	#	0_host	F-say.IPFV-PRS,"""At our place no one steals,"" she said.",en,MORPHEME_ALIGNED,,ramazan_mp3 ramazan_wav ramazan_eaf ramazan_xml ramazan_tsv,,209356,212005,#ds_pc.neg	nc	ln_pro.1:poss	other:l	np.h:s	v:predex	##	0.h:s_ds	v:pred,,ramazan,∅	∅	746	∅	∅	∅	∅	731	∅,∅	∅	746	∅	∅	∅	∅	731	∅,∅	∅	bridging	∅	∅	∅	∅	∅	∅
